query,response,reasoning_type
"Why do people love anime like Your Name?","Your Name resonates because it masterfully combines: 1) Universal themes of connection and longing, 2) Stunning visual artistry that elevates every scene, 3) A time-bending plot that keeps viewers engaged, 4) Emotional depth in character relationships, 5) A perfect blend of humor, romance, and drama. Shinkai's ability to capture fleeting moments of beauty and melancholy creates a deeply emotional experience.","emotional_analysis"
"Naruto में friendship theme इतना powerful क्यों है?","Naruto में friendship powerfully portrayed है क्योंकि: 1) Naruto's own loneliness से start होता है making bonds meaningful, 2) Team 7 dynamics show growth through trust, 3) Sasuke's story proves friendship's limits और unconditional nature, 4) Side characters (Shikamaru-Asuma, Kakashi's past) deepen the theme, 5) Battles often resolve through understanding not just strength।","thematic_analysis"
"What makes Attack on Titan's plot twists effective?","Attack on Titan's plot twists work because: 1) Heavy foreshadowing that rewards rewatching, 2) Each reveal fundamentally changes context of earlier events, 3) Twists serve character development not just shock value, 4) The basement revelation perfectly delivers on years of build-up, 5) Moral complexity increases with each revelation, 6) Isayama plants subtle clues episodes/chapters ahead.","storytelling_analysis"
"Should I watch One Piece despite 1000+ episodes?","Consider these factors: 1) YES if you enjoy long-form storytelling with deep world-building, 2) YES if character development over hundreds of episodes appeals to you, 3) NO if you need quick resolutions, 4) Alternative: Read the manga (faster pace), use episode guides to skip filler, or watch One Pace (fan edit removing padding). The investment pays off with one of anime's richest narratives.","recommendation_logic"
"Jujutsu Kaisen Hunter x Hunter से inspired क्यों लगता है?","JJK definitely draws inspiration from HxH: 1) Complex power system with conditions (Nen vs Cursed Techniques), 2) Smart battle tactics over raw power, 3) Dark tone with character deaths, 4) Training arcs that matter, 5) Gojo's casualness mirrors Gon's mentors. However, JJK has faster pacing, different themes (curses as negativity), और modern setting। It's inspired but not derivative.","comparative_analysis"
"Why do anime openings matter so much?","Anime openings serve multiple crucial functions: 1) Set the tone and atmosphere for the series, 2) Showcase key characters and themes visually, 3) Create anticipation and excitement each episode, 4) Music becomes emotionally linked to the story, 5) Cultural phenomenon - many become iconic (Unravel, Gurenge), 6) Often contain foreshadowing savvy viewers catch on rewatch.","cultural_analysis"
"Isekai anime itne popular kyu ho gaye?","Isekai popularity stems from: 1) Escapism appeal - starting fresh in new world, 2) Power fantasy fulfillment, 3) Game mechanics make power progression satisfying, 4) Lower entry barrier than complex fantasy worlds, 5) Wish fulfillment (harem, hero status), 6) Video game generation relates to game-like worlds. However, oversaturation led to criticism for repetitive plots.","trend_analysis"
"What defines a masterpiece anime?","Masterpiece anime typically have: 1) Exceptional execution across multiple elements (story, animation, sound, characters), 2) Thematic depth that provokes thought, 3) Lasting cultural impact and influence, 4) Emotional resonance with broad audiences, 5) Technical innovation or artistic excellence, 6) Rewatchability with new insights. Examples: FMAB, Steins;Gate, Monster, Cowboy Bebop.","criteria_analysis"
"Studio Ghibli films बच्चों और adults दोनों को क्यों appeal करती हैं?","Ghibli's universal appeal comes from: 1) Surface level: Beautiful visuals, whimsical creatures, adventure, 2) Deeper level: Complex themes (environmentalism, war, growing up), 3) No clear villains - morally nuanced, 4) Strong female protagonists, 5) Magical realism blended with real emotions, 6) Doesn't talk down to children while remaining accessible, 7) Emotional maturity in storytelling.","audience_analysis"
"Why does anime use flashbacks so much?","Flashback usage serves: 1) Character backstory without disrupting present flow, 2) Emotional impact at pivotal moments (Kakashi-Obito during battle), 3) Revealing mysteries gradually, 4) Budget management (reusing scenes), 5) Manga adaptation pacing (stretching content). Overuse becomes problematic when it disrupts tension or repeats same scenes excessively.","technique_analysis"
"Seinen anime shonen से better hai kya?","Neither is objectively better - they serve different purposes: 1) Seinen targets mature audiences with complex themes, realistic violence, psychological depth (Monster, Berserk), 2) Shonen focuses on growth, friendship, determination (Naruto, MHA), 3) Both have masterpieces and trash, 4) Quality depends on execution not demographic, 5) Many shonen tackle mature themes too. Enjoy both without elitism.","comparative_reasoning"
"Slice of life anime boring kyu nahi hoti despite no action?","Slice of life works because: 1) Relatability - depicts everyday life's beauty, 2) Character-driven rather than plot-driven, 3) Subtle emotional depth and growth, 4) Comforting and therapeutic (iyashikei), 5) Attention to small details and moments, 6) Shows like March Comes in Like a Lion, Violet Evergarden prove emotional impact rivals action. It's about finding drama in ordinary life.","genre_analysis"
"What makes anime adaptations better or worse than manga?","Better adaptations: 1) Add voice acting, music, animation bringing scenes to life, 2) Improve pacing (removing fat), 3) Enhance action sequences, 4) Add original content that complements (FMAB). Worse adaptations: 1) Filler that disrupts flow, 2) Rushed pacing skipping development, 3) Changed endings, 4) Poor animation/direction, 5) Censorship. Examples: Demon Slayer enhanced manga, Tokyo Ghoul:re disappointed manga readers.","adaptation_analysis"
"Why do tournament arcs work so well in shonen?","Tournament arcs effective because: 1) Showcase multiple characters' abilities efficiently, 2) Clear stakes and progression, 3) Hype building through brackets/matchups, 4) Character moments outside battles (sportsmanship, rivalry), 5) Power scaling demonstrations, 6) Strategic battles when done well. Best examples: Chunin Exams (Naruto), Heaven's Arena (HxH), Sports Festival (MHA).","structural_analysis"
"Anime industry के problems क्या हैं?","Major industry issues: 1) Animator underpayment and overwork (exploitation), 2) Seasonal crunch culture, 3) Oversaturation leading to quality drops, 4) Heavy reliance on disc sales model, 5) Committee system diluting creative vision, 6) Lack of proper royalties for creators. These affect sustainability despite global popularity growth.","industry_analysis"
"Why are anime movies often better than series?","Movie advantages: 1) Concentrated budget per minute (higher animation quality), 2) Self-contained story allows focused narrative, 3) No filler or pacing issues, 4) Theatrical experience enhances impact, 5) Directors can execute complete vision, 6) Examples: Ghibli films, Makoto Shinkai works. However, series allow deeper character development over time - each format has strengths.","format_comparison"
"Character development vs plot progression - which matters more?","Both are crucial but depend on genre: 1) Character-driven stories (Vinland Saga, 3-gatsu) prioritize growth over events, 2) Plot-driven (Death Note, AOT) use story to challenge characters, 3) Best anime balance both (FMAB), 4) Poor writing sacrifices one completely, 5) Without character development, plot feels hollow; without plot, characters don't evolve. Integration matters most.","storytelling_philosophy"
"Why do people get emotional about anime despite being 'just drawings'?","Emotional impact occurs because: 1) Animation allows expressive exaggeration impossible in live-action, 2) Voice acting conveys raw emotion, 3) Music amplifies feelings precisely, 4) Art style creates aesthetic beauty and atmosphere, 5) Stories tackle universal human experiences, 6) Suspension of disbelief isn't about medium but execution. Good storytelling transcends format - Clannad, Your Lie in April prove this.","psychological_analysis"
"Sub vs dub - which is actually better?","Nuanced answer: 1) Subs preserve original voice acting, cultural nuances, lip sync, 2) Dubs allow focus on visuals, accessibility for some viewers, 3) Modern dubs (MHA, Cowboy Bebop) are excellent, 4) Some shows better dubbed (Bebop, FMAB), others better subbed (Gintama - wordplay), 5) Personal preference valid either way. Watch what you enjoy - don't let elitism dictate.","preference_analysis"
"Why do anime series decline in quality after early seasons?","Common decline reasons: 1) Different studios/directors (One Punch Man S1→S2), 2) Catching up to source material forcing filler, 3) Budget/time constraints increase, 4) Original vision lost with team changes, 5) Success pressure leads to rushed production, 6) Committee interference increases. Not universal - some improve (JoJo parts, Mob Psycho) with proper planning and passion.","quality_analysis"